{
  "blog": {
    "title": "Mi Blog de Pruebas",
    "description": "Bitácora sobre tecnología, diseño web y desarrollo de plantillas.",
    "url": "https://ejemplo.blogspot.com/",
    "canonicalUrl": "https://ejemplo.blogspot.com/",
    "homepageUrl": "https://ejemplo.blogspot.com/",
    "bloggerUrl": "https://www.blogger.com",
    "blogId": "1234567890123456789",
    "blogspotFaviconUrl": "https://ejemplo.blogspot.com/favicon.ico",
    "locale": "es",
    "localeUnderscoreDelimited": "es",
    "languageDirection": "ltr",
    "encoding": "UTF-8",
    "isMobileRequest": false,
    "adultContent": false,
    "httpsEnabled": true,
    "hasCustomDomain": false,
    "adsenseHasAds": false,
    "adsenseAutoAds": false,
    "enabledCommentProfileImages": true,
    "metaDescription": "Bitácora sobre tecnología, diseño web y desarrollo de plantillas.",
    "pageType": "index",
    "pageTitle": "Entradas con la etiqueta tecnología - Mi Blog de Pruebas",
    "pageName": "Entradas con la etiqueta tecnología - Mi Blog de Pruebas",
    "searchLabel": "tecnologia",
    "searchUrl": "https://ejemplo.blogspot.com/search",
    "adsenseClientId": "ca-pub-1234567890123456",
    "adsenseHostId": "ca-host-pub-1556223355139109"
  },
  "view": {
    "type": "feed",
    "title": "Entradas con la etiqueta tecnología - Mi Blog de Pruebas",
    "description": "Entradas clasificadas bajo la etiqueta tecnología.",
    "url": "https://ejemplo.blogspot.com/search/label/tecnologia",
    "isHomepage": false,
    "isPost": false,
    "isPage": false,
    "isArchive": false,
    "isSearch": true,
    "isLabelSearch": true,
    "isError": false,
    "isMultipleItems": true,
    "isSingleItem": false,
    "search": {
      "label": "tecnologia",
      "resultsMessage": "Mostrando entradas con la etiqueta tecnologia",
      "resultsMessageHtml": "Mostrando entradas con la etiqueta <b>tecnologia</b>"
    }
  },
  "messages": {
    "archive": "Archivo",
    "at": "a la(s)",
    "authorSaid": "%1 dijo&hellip;",
    "by": "por",
    "comments": "Comentarios",
    "deleteComment": "Eliminar comentario",
    "home": "Inicio",
    "morePosts": "Más entradas",
    "newer": "Más recientes",
    "newerPosts": "Entradas más recientes",
    "older": "Más antiguas",
    "olderPosts": "Entradas más antiguas",
    "noResultsFound": "No se han encontrado resultados",
    "postAComment": "Publicar un comentario",
    "postComment": "Publicar comentario",
    "posts": "Entradas",
    "readMore": "Leer más",
    "search": "Buscar",
    "share": "Compartir",
    "subscribe": "Suscribirse",
    "labels": "Etiquetas",
    "location": "Ubicación"
  },
  "skin": {
    "vars": {
      "body_font": "16px Arial, sans-serif",
      "body_background_color": "#ffffff",
      "body_text_color": "#333333",
      "keycolor": "#1a73e8",
      "header_title_color": "#202124"
    }
  },
  "widgets": {
    "Blog": [
      {
        "id": "Blog1",
        "type": "Blog",
        "sectionId": "main",
        "title": "Entradas del blog"
      }
    ],
    "Header": [
      {
        "id": "Header1",
        "type": "Header",
        "sectionId": "header",
        "title": "Mi Blog de Pruebas"
      }
    ],
    "PageList": [
      {
        "id": "PageList1",
        "type": "PageList",
        "sectionId": "header",
        "title": "Páginas"
      }
    ],
    "Label": [
      {
        "id": "Label1",
        "type": "Label",
        "sectionId": "sidebar",
        "title": "Etiquetas"
      }
    ],
    "BlogArchive": [
      {
        "id": "BlogArchive1",
        "type": "BlogArchive",
        "sectionId": "sidebar",
        "title": "Archivo del blog"
      }
    ],
    "FeaturedPost": [
      {
        "id": "FeaturedPost1",
        "type": "FeaturedPost",
        "sectionId": "sidebar",
        "title": "Entrada destacada"
      }
    ],
    "PopularPosts": [
      {
        "id": "PopularPosts1",
        "type": "PopularPosts",
        "sectionId": "sidebar",
        "title": "Entradas populares"
      }
    ],
    "Profile": [
      {
        "id": "Profile1",
        "type": "Profile",
        "sectionId": "sidebar",
        "title": "Sobre el autor"
      }
    ],
    "HTML": [
      {
        "id": "HTML1",
        "type": "HTML",
        "sectionId": "sidebar",
        "title": "HTML Personalizado"
      }
    ],
    "LinkList": [
      {
        "id": "LinkList1",
        "type": "LinkList",
        "sectionId": "sidebar",
        "title": "Enlaces Útiles"
      }
    ],
    "BlogSearch": [
      {
        "id": "BlogSearch1",
        "type": "BlogSearch",
        "sectionId": "sidebar",
        "title": "Buscar en el blog"
      }
    ]
  },
  "widgetData": {
    "Blog1": {
      "title": "Entradas del blog",
      "numPosts": 7,
      "languageCode": "es",
      "allBylineItems": [
        {
          "name": "share",
          "label": "Compartir"
        },
        {
          "name": "author",
          "label": "Por"
        },
        {
          "name": "timestamp",
          "label": "a la(s)"
        },
        {
          "name": "comments",
          "label": "Comentarios"
        },
        {
          "name": "icons",
          "label": "Iconos"
        },
        {
          "name": "labels",
          "label": "Etiquetas"
        },
        {
          "name": "location",
          "label": "Ubicación"
        }
      ],
      "posts": [
        {
          "id": "1001",
          "title": "Guía Definitiva de Plantillas Blogger",
          "url": "https://ejemplo.blogspot.com/2026/10/guia-definitiva-de-plantillas.html",
          "absoluteUrl": "https://ejemplo.blogspot.com/2026/10/guia-definitiva-de-plantillas.html",
          "body": "<p>Aprende las mejores prácticas para crear temas modernos en Blogger Layouts v3. Este artículo cubre la resolución ontológica de includables, expresiones lambda y la compilación de Theme Designer.</p>",
          "date": "28 de octubre de 2026",
          "lastUpdated": "28 de octubre de 2026",
          "featuredImage": "https://images.unsplash.com/photo-1555066931-4365d14bab8c?w=1200",
          "thumbnailUrl": "https://images.unsplash.com/photo-1555066931-4365d14bab8c?w=150",
          "author": {
            "name": "Abel",
            "profileUrl": "https://www.blogger.com/profile/0123456789",
            "aboutMe": "Desarrollador web y autor de especificaciones de plantillas.",
            "authorPhoto": {
              "url": "https://lh3.googleusercontent.com/a/default-user=s80-c",
              "width": 80,
              "height": 80,
              "alt": "Foto de Abel"
            }
          },
          "labels": [
            {
              "name": "tecnologia",
              "url": "https://ejemplo.blogspot.com/search/label/tecnologia"
            },
            {
              "name": "blogger",
              "url": "https://ejemplo.blogspot.com/search/label/blogger"
            }
          ],
          "snippets": {
            "short": "Aprende las mejores prácticas para crear temas modernos en Blogger...",
            "long": "Aprende las mejores prácticas para crear temas modernos en Blogger Layouts v3 paso a paso con ejemplos reales y pruebas empíricas."
          },
          "numberOfComments": 2,
          "allowComments": true,
          "allowNewComments": true,
          "showThreadedComments": true,
          "hasJumpLink": true,
          "comments": [
            {
              "id": "c1001",
              "author": "Carlos",
              "authorAvatarSrc": "https://lh3.googleusercontent.com/a/default-user=s35-c",
              "authorUrl": "https://carlos.dev",
              "authorUserType": "BLOGGER",
              "body": "<p>Excelente artículo sobre plantillas Blogger. Muy completo.</p>",
              "timestamp": "28 de octubre de 2026, 10:30",
              "timestampValue": 1793201400000,
              "timestampAbs": 1793201400000,
              "inReplyTo": "",
              "isDeleted": false,
              "adminClass": "",
              "deleteUrl": "https://www.blogger.com/delete-comment.g?blogID=1234567890123456789&postID=c1001",
              "url": "https://ejemplo.blogspot.com/2026/10/guia-definitiva-de-plantillas.html#c1001",
              "anchorName": "c1001"
            },
            {
              "id": "c1002",
              "author": "Abel",
              "authorAvatarSrc": "https://lh3.googleusercontent.com/a/default-user=s80-c",
              "authorUrl": "https://www.blogger.com/profile/0123456789",
              "authorUserType": "BLOGGER",
              "body": "<p>¡Muchas gracias Carlos! Me alegra que te sirva de guía.</p>",
              "timestamp": "28 de octubre de 2026, 11:15",
              "timestampValue": 1793204100000,
              "timestampAbs": 1793204100000,
              "inReplyTo": "c1001",
              "isDeleted": false,
              "adminClass": "is-admin",
              "deleteUrl": "https://www.blogger.com/delete-comment.g?blogID=1234567890123456789&postID=c1002",
              "url": "https://ejemplo.blogspot.com/2026/10/guia-definitiva-de-plantillas.html#c1002",
              "anchorName": "c1002"
            }
          ],
          "commentFormIframeSrc": "https://www.blogger.com/comment-iframe.g?blogID=1234567890123456789&postID=1001"
        },
        {
          "id": "1002",
          "title": "Novedades de XML en Blogger Layouts v3",
          "url": "https://ejemplo.blogspot.com/2026/10/novedades-de-xml.html",
          "absoluteUrl": "https://ejemplo.blogspot.com/2026/10/novedades-de-xml.html",
          "body": "<p>Revisión en profundidad de los atributos expr:*, b:with, b:switch y las nuevas capacidades de manipulación semántica del DOM.</p>",
          "date": "20 de octubre de 2026",
          "lastUpdated": "21 de octubre de 2026",
          "featuredImage": "https://images.unsplash.com/photo-1461749280684-dccba630e2f6?w=1200",